name_of_satellite_alternate_names,country_of_operator_owner,operator_owner,users,purpose,class_of_orbit,type_of_orbit,date_of_launch,expected_lifetime (in years),comments,longitude_of_geo_degrees,perigee_km,apogee_km,eccentricity,inclination_degrees,period_minutesTiangong-1 (TG-1),China (PR),   Beijing Aerospace Flight Control Center,Government,Technology Development,LEO,,2011-09-29,2,First of the three experimental single-module orbital stations (Space Laboratory) to be launched by China between 2011 and 2016 to develop and test a range of techniques required for building a permanently-manned space station.,0,329,340,0.00082,42.79,91.23Tian Xun-1 (TX-1),China (PR),   NanjingÌ_UniversityÌ_ofÌ_AeronauticsÌ_andÌ_Astronautics,Civil,Technology Development,LEO,,2011-11-09,,"""Equipped with a 2.5 kg CCD camera that was built by Suzhou University, sporting a maximum resolution of 30 meters.""",0,480,490,0.000729,97.42,94.3Electro-L1 (GOMS 2 [Geostationary Ioperational Meteorological Satellite 2],Russia,   Roshydromet - Planeta,Government,Meteorological,GEO,,2011-01-20,10,"""Satellite's position in GEO will yield real-time views of entire Earth disk -- wide swath of Asia, Middle East and Indian Ocean. Will also provide communciations for search-and-rescue services.""",76,"""35,323""","""35,750""",0.00509,0.46,1423.35HYLAS 1 (Highly Adaptable Satellite),UK,"""Avanti Communications, PLC""",Commercial,Communications,GEO,,2010-11-26,15,Stated goal of providing broadband internet access to people in the areas hardest to reach by terrestrial connectivity means,-33.5,"""35,770""","""35,803""",0.000391,0.01,1436.07AIM (Aeronomy of Ice in Mesosphere),USA,"""Center for Atmospheric Sciences, Hampton University/NASA""",Government,Earth Science,LEO,,2007-04-25,2,Study noctilucent clouds (NLC) in the polar mesosphere. In 2011 the mission was extended through FY 2012.,0,586,601,0.00108,97.79,96.55"""Cubesat XI-IV (Oscar 57, CO-57)""",Japan,"Department of Astronautics, University of Tokyo",Civil,Technology Development,LEO,Sun-Synchronous,2003-06-30,,On-orbit verification of the super small satellite (nano-satellite) bus system using commercial-off-the-shell components.,0,822,828,0.000417,98.7,101.4"""Cubesat XI-V (Oscar 58, CO-58)""",Japan,"Department of Astronautics, University of Tokyo",Civil,Technology Development,LEO,Sun-Synchronous,2005-10-27,,Backup for Cubesat II-IV.,0,682,708,0.00184,98.1,98.66DirecTV-7S ,USA,"DirecTV, Inc.",Commercial,Communications,GEO,,2004-05-04,15,Direct-to-home TV; 54 transponders.,-119.04,"""35,774""","""35,797""",0.000273,0.01,1436.1DirecTV-1R ,USA,"DirecTV, Inc.",Commercial,Communications,GEO,,1999-10-10,15,"""First commercial launch by Sea Launch consortium (American, Russian, Ukrainian companies); 16 Ku-band; video channels directly to home-based dishes; anticipated 50 million homes in North America.""",-72.48,"""35,778""","""35,795""",0.000202,0.03,1436.1DirecTV-4S ,USA,"DirecTV, Inc.",Commercial,Communications,GEO,,2001-11-27,15,Direct broadcasting; 48 Ku-band; 300 local TV channels to 41 metropolitan communities through 11 C-band transponders.,-101.15,"""35,780""","""35,792""",0.000142,0.05,1436.09DirecTV-5 (Tempo 1),USA,"DirecTV, Inc.",Commercial,Communications,GEO,,2002-05-07,15,Digital television to North American subscribers; 32 Ku-band; direct broadcasting.,-110.05,"""35,773""","""35,799""",0.000308,0.07,1436.08Spaceway F1,USA,"DirecTV, Inc.",Commercial,Communications,GEO,,2005-04-26,12,17 Ku-band transponders; high definition.,-102.87,"""35,785""","""35,787""",0.0000237,0.05,1436.1DirecTV-8,USA,"DirecTV, Inc.",Commercial,Communications,GEO,,2005-05-22,12,36 Ku- and Ka-band transponders.,-100.81,"""35,777""","""35,796""",0.000225,0.02,1436.1Spaceway F2,USA,"DirecTV, Inc.",Commercial,Communications,GEO,,2005-11-16,12,17 Ku-band transponders; high definition.,-99.08,"""35,785""","""35,787""",0.0000237,0.04,1436.1DirecTV-9S,USA,"DirecTV, Inc.",Commercial,Communications,GEO,,2006-10-13,15,"""52 Ku-band and 2 Ka-band transponders; direct-to-home, voice, video and internet.""",-101.08,"""35,774""","""35,798""",0.000285,0.03,1436.1DirecTV-10,USA,"DirecTV, Inc.",Commercial,Communications,GEO,,2007-07-07,15,32 broad-beam Ka band; 55 spot-beam Ka-band transponders; will provide HDTV to CONUS.,-102.74,"""35,785""","""35,788""",0.0000356,0.04,1436.1DirecTV-11,USA,"DirecTV, Inc.",Commercial,Communications,GEO,,2008-03-19,,High definition channels for North America.,-99.21,"""35,786""","""35,786""",0,0.03,1436.1DirecTV-12,USA,"DirecTV, Inc.",Commercial,Communications,GEO,,2009-12-29,15,High-definition for North America.,-102.8,"""35,785""","""35,786""",0.0000119,0.09,1436.04Echostar 3 ,USA,"Echostar Technologies, LLC",Commercial,Communications,GEO,,1997-10-05,12,Central/Mountain region to Eastern U.S.; 32 Ku-band transponders,-61.46,"""35,783""","""35,790""",0.000083,0.02,1436.11Echostar 6 ,USA,"Echostar Technologies, LLC",Commercial,Communications,GEO,,2000-07-14,12,"""CONUS, Hawaii, Alaska and Puerto Rico; 32 Ku-band transponders""",-72.71,"""35,775""","""35,798""",0.000273,0.07,1436.12Echostar 7 ,USA,"Echostar Technologies, LLC",Commercial,Communications,GEO,,2002-02-21,12,"""CONUS, Hawaii, Alaska and Puerto Rico; 32 Ku-band transponders""",-118.85,"""35,782""","""35,789""",0.000083,0.01,1436.07Echostar 8 ,USA,"Echostar Technologies, LLC",Commercial,Communications,GEO,,2002-08-21,12,"""CONUS, Hawaii, Alaska and Puerto Rico; 32 Ku-band transponders""",-76.97,"""35,783""","""35,789""",0.0000712,0.01,1436.1Echostar 12 (Rainbow-1) ,USA,"Echostar Technologies, LLC",Commercial,Communications,GEO,,2003-07-17,18,Direct-to-home television services; cable's attempt to compete with dish networks.,-61.63,"""35,782""","""35,791""",0.000107,0.06,1436.11Echostar 10,USA,"Echostar Technologies, LLC",Commercial,Communications,GEO,,2006-02-15,15,"""Direct-to-home transmission of voice, video and internet.""",-110.07,"""35,780""","""35,792""",0.000142,0.06,1436Echostar 11,USA,"Echostar Technologies, LLC",Commercial,Communications,GEO,,2008-07-16,15,Direct-to-home television.,-109.97,"""35,778""","""35,793""",0.000178,0.03,1436.1Echostar 14,USA,"Echostar Technologies, LLC",Commercial,Communications,GEO,,2010-03-20,15,Direct-to-home over CONUS.,-119,"""35,785""","""35,789""",0.0000474,0.05,1436.11Echostar 15,USA,"Echostar Technologies, LLC",Commercial,Communications,GEO,,2010-07-10,15,Direct-to-home over CONUS.,-61.5,"""35,789""","""35,803""",0.000166,0.07,1436.57"""Echostar 9/Galaxy 23 (G-23, Intelsat 1A-13, Telstar 13)""",USA,"Echostar Technologies, LLC",Commercial,Communications,GEO,,2003-08-08,13,"""24 C-band, 2 Ka-band, 32 Ku-band; additional C-band payload owned and operated by Loral Skynet.""",-121.02,"""35,775""","""35,797""",0.000261,0.01,1436.08"""Grace 1 (Gravity Recovery and Climate Experiment, """"Tom and Jerry"""")""",Germany/USA,"""GeoForschungsZentrum (GFZ)/Center for Space Research, University of Texas""",Civil,Earth Science,LEO,Polar,2002-03-17,5,"""Map gravitational mini-variations caused by sea-level changes, glaciers and melting/freezing of ice sheets by measuring distance between satellites.""",0,482,506,0.00175,89,94.49"""Grace 2 (Gravity Recovery and Climate Experiment, """"Tom and Jerry"""")""",Germany/USA,"""GeoForschungsZentrum (GFZ)/Center for Space Research, University of Texas""",Civil,Earth Science,LEO,Polar,2002-03-17,5,"""Map gravitational mini-variations caused by sea-level changes, glaciers and melting/freezing of ice sheets by measuring distance between satellites.""",0,482,507,0.00182,89,94.5Horizons 2,USA/Japan,"""Horizons 2 Satellite, LLC (Intelsat, Sky Perfect JSAT Corporation)""",Commercial,Communications,GEO,,2007-12-21,15,"""Joint venture between Intelsat and JSAT; 20 Ku-band transponders, services to the US, Canada and Japan.""",85,"""35,777""","""35,796""",0.000225,0,1436.1EROS A1 (Earth Resources Observation Satellite),Israel,"""ImageSat International, NV/Ministry of Defense""",Military/Commercial,Remote Sensing,LEO,Sun-Synchronous,2000-12-05,6,"""High resolution imaging satellite; obtain images (with terrain width of 12.6 km) of locations chosen by Israeli military or worldwide commercial clients; in Jan. 2001 Ministry of Defense bought rights to all imaging of Israel and territories within 2,000 km radius.""",0,491,502,0.000801,97.3,94.55EROS B1 (Earth Resources Observation Satellite),Israel,"""ImageSat International, NV/Ministry of Defense""",Military/Commercial,Remote Sensing,LEO,Sun-Synchronous,2006-04-25,10,"""High resolution imaging satellite; obtain images (with resolution of 0.82 meters) of locations chosen by Israeli military or worldwide commercial clients; in Jan. 2001 Ministry of Defense bought rights to all imaging of Israel and territories within 2,000 km around Israel.""",0,503,516,0.000945,97.33,94.82INMARSAT 2 F2 ,United Kingdom,"INMARSAT, Ltd.",Commercial,Communications,GEO,,1991-03-08,10,"""Leased traffic; broadcasting, business services, mobile communciations; spare satellite co-located with Inmarsat 3s.""",-98.14,"""35,770""","""35,802""",0.00038,5.47,1436.09INMARSAT 2 F4 ,United Kingdom,"INMARSAT, Ltd.",Commercial,Communications,GEO,,1992-04-15,10,"""Broadcasting, business services, mobile communications; leased traffic;  spare satellite co-located with Inmarsat 3s.""",-108.91,"""35,779""","""35,796""",0.000202,4.12,1436.17INMARSAT 3 F1 ,United Kingdom,"INMARSAT, Ltd.",Commercial,Communications,GEO,,1996-04-03,13,"""Broadcasting, business services, mobile communications; leased traffic; demand-assigned L-band transponders; Indian Ocean region.""",64.56,"""35,764""","""35,808""",0.000522,0.08,1436.08INMARSAT 3 F2 ,United Kingdom,"INMARSAT, Ltd.",Commercial,Communications,GEO,,1996-09-06,13,"""Broadcasting, business services, mobile communications; demand assigned L-band transponders; Atlantic Ocean region.""",-15.52,"""35,763""","""35,809""",0.000546,0.08,1436.1INMARSAT 3 F3 ,United Kingdom,"INMARSAT, Ltd.",Commercial,Communications,GEO,,1996-12-18,13,"""Broadcasting, business services, mobile communications; demand assigned L-band transponders; Pacific Ocean region.""",178.2,"""35,761""","""35,810""",0.000581,0.09,1436.07INMARSAT 3 F4 ,United Kingdom,"INMARSAT, Ltd.",Commercial,Communications,GEO,,1997-06-03,13,"""Broadcasting, business services, mobile communications; demand assigned L-band transponders; Atlantic Ocean region-West.""",-125.39,"""35,609""","""35,642""",0.000393,0.06,1427.91INMARSAT 3 F5 ,United Kingdom,"INMARSAT, Ltd.",Commercial,Communications,GEO,,1998-02-04,13,"""Broadcasting, business services, mobile communications; demand assigned L-band transponders; back-up and leased-capacity.""",25.07,"""35,769""","""35,803""",0.000403,0.04,1436.07INMARSAT 4 F1,United Kingdom,"INMARSAT, Ltd.",Commercial,Communications,GEO,,2005-03-11,15,Nearly the size of a double-decker bus; more than 600 channels.,63.96,"""35,772""","""35,799""",0.00032,2.3,1436.08INMARSAT 4 F2,United Kingdom,"INMARSAT, Ltd.",Commercial,Communications,GEO,,2005-11-08,15,Nearly the size of a double-decker bus; more than 600 channels.,-52.76,"""35,773""","""35,800""",0.00032,2.33,1436.11INMARSAT 4 F3,United Kingdom,"INMARSAT, Ltd.",Commercial,Communications,GEO,,2008-08-18,15,"""200 spot-beams to relay messages from mobile phones based on land, sea, or air.""",-97.65,"""35,775""","""35,798""",0.000273,3.01,1436.1Akebono (EXOS-D),Japan,"""Institute of Space and Aeronautical Science, University of Tokyo""",Civil,Space Physics,Elliptical,,1989-02-21,1,Investigate particle acceleration regions above auroral region; develop better understanding of acceleration mechanism and relation to substorm phenomena.,0,264,"""5,732""",0.292,75.1,150.4"""Galaxy-25 (G-25, Intelsat 1A-5, Telstar 5)""",USA,"Intelsat, Ltd.",Commercial,Communications,GEO,,1997-05-24,13,"""24 C-band, 28 Ku-band; U.S., southern Canada, Mexico, Caribbean.""",-93.09,"""35,771""","""35,801""",0.000356,0.03,1436.08"""Galaxy-26 (G-26, Intelsat 1A-6, Telstar 6)""",USA,"Intelsat, Ltd.",Commercial,Communications,GEO,,1999-02-15,13,"""24 C-band, 28 Ku-band; U.S., southern Canada, Mexico, Caribbean; has experienced several anomalies and brief shutdowns.""",-93.01,"""35,778""","""35,795""",0.000202,0.01,1436.11Intelsat 602 (Intelsat 6 F-2),USA,"Intelsat, Ltd.",Commercial,Communications,GEO,,1989-10-27,13,Inclined orbit; Indian Ocean region; C-band and Ku-band broadcasting.,178.04,"""35,799""","""35,792""",-0.000083,6.51,1436.08Intelsat 701 ,USA,"Intelsat, Ltd.",Commercial,Communications,GEO,,1993-10-22,10,"""42 C-band, 24 Ku-band; broadcasting, business services, direct-to-home TV broadcasting, telecommunications, VSATnetworks; Pacific Ocean region. """,179.94,"""35,775""","""35,797""",0.000261,0.01,1436.08Intelsat 702 ,USA,"Intelsat, Ltd.",Commercial,Communications,GEO,,1994-06-17,15,"""42 C-band, 24 Ku-band; broadcasting, business services, direct-to-home TV broadcasting, telecommunications, VSATnetworks; Pacific Ocean region. """,54.92,"""35,776""","""35,796""",0.000237,0.02,1436.1Intelsat 706 ,USA,"Intelsat, Ltd.",Commercial,Communications,GEO,,1995-05-17,15,"""42 C-band, 36 Ku-band; broadcasting, business services, direct-to-home TV broadcasting, telecommunications, VSATnetworks Atlantic Ocean region. """,50.3,"""35,776""","""35,795""",0.000225,0.01,1436.07Intelsat 24 (Amos 1),USA,"Intelsat, Ltd.",Commercial,Communications,GEO,,1996-05-16,10,Sold to Intelsat in 2009.,47.3,"""35,770""","""35,800""",0.000356,1.38,1436.04Intelsat 709 ,USA,"Intelsat, Ltd.",Commercial,Communications,GEO,,1996-06-15,15,"""42 C-band, 24 Ku-band; broadcasting, business services, direct-to-home TV broadcasting, telecommunications, VSATnetworks; Atlantic Ocean region. """,85.18,"""35,775""","""35,798""",0.000273,0,1436.11"""Intelsat 26 (JCSat R, JCSAT-4, Japan Communications Satellite 4)""",USA,"Intelsat, Ltd.",Commercial,Communications,GEO,,1997-02-16,12,"""Backup for JCSAT-3; 12 C-band, 12 Ku-band; relay voice, data, television signals via Ku-band to eastern Asia, Australia, New Zealand, India; via C-band to eastern and southern Asia and Hawaii. Digital TV. Sold to Intelsat in 2010.""",50,"""35,779""","""35,794""",0.000178,0.02,1436.1Intelsat 801,USA,"Intelsat, Ltd.",Commercial,Communications,GEO,,1997-02-28,14,"""64 C-band, 16 Ku-band; broadcasting, business services, direct-to-home TV broadcasting, telecommunications, VSAT networks; Atlantic Ocean region.""",-31.47,"""35,767""","""35,802""",0.000415,0.21,1436.14"""Intelsat 5 (Arabsat 2C, Panamsat-5, PAS-5)""",USA,"Intelsat, Ltd.",Commercial,Communications,   GEO,,1997-08-28,15,"""28 C-band, 28 Ku-band; covers Arab world. Inclined.""",26.11,"""35,774""","""35,798""",0.000285,0.03,1436.09Intelsat 805 ,USA,"Intelsat, Ltd.",Commercial,Communications,GEO,,1998-06-18,14,"""36 C-band, 6 Ku-band, broadcasting, business services, direct-to-home TV broadcasting, telecommunications, VSAT networks; Atlantic Ocean region.""",-55.49,"""35,775""","""35,797""",0.000261,0.01,1436.08Intelsat APR-2 (INSAT 2E),USA,"Intelsat, Ltd.",Commercial,Communications,GEO,,1999-04-03,12,"""6 C-band, broadcasting, business services, direct-to-home TV broadcasting, telecommunications, VSAT networks; Asia Pacific region.""",83.03,"""35,769""","""35,804""",0.000415,0.18,1436.11"""Galaxy-27 (G-27, Intelsat IA-7, Telstar 7)""",USA,"Intelsat, Ltd.",Commercial,Communications,GEO,,1999-09-25,13,"""24 C-band, 24 Ku-band; voice and video to North and Central America; a 2004 anomaly resulted in loss of half its capacity.""",-128.93,"""35,776""","""35,794""",0.000213,0,1436.06Intelsat 901 ,USA,"Intelsat, Ltd.",Commercial,Communications,GEO,,2001-06-09,13,"""72 C-band, 22 Ku-band, broadcasting, business services, direct-to-home TV broadcasting, telecommunications, VSAT networks; Atlantic Ocean region.""",-18.01,"""35,775""","""35,798""",0.000273,0.01,1436.12Intelsat 902 ,USA,"Intelsat, Ltd.",Commercial,Communications,GEO,,2001-08-30,13,"""76 C-band, 22 Ku-band, broadcasting, business services, direct-to-home TV broadcasting, telecommunications, VSAT networks; Indian Ocean region.""",62.05,"""35,775""","""35,797""",0,1436.1,1436.1Intelsat 904 ,USA,"Intelsat, Ltd.",Commercial,Communications,GEO,,2002-02-23,13,"""76 C-band, 22 Ku-band, broadcasting, business services, direct-to-home TV broadcasting, telecommunications, VSAT networks; Indian Ocean region.""",60.05,"""35,782""","""35,789""",0.000083,0.01,1436.07Intelsat 903 ,USA,"Intelsat, Ltd.",Commercial,Communications,GEO,,2002-03-30,13,"""76 C-band, 22 Ku-band, broadcasting, business services, direct-to-home TV broadcasting, telecommunications, VSAT networks; Atlantic Ocean region.""",-34.55,"""35,773""","""358,802""",0.793,0.02,1436.16Intelsat 905 ,USA,"Intelsat, Ltd.",Commercial,Communications,GEO,,2002-06-05,13,"""76 C-band, 22 Ku-band, broadcasting, business services, direct-to-home TV broadcasting, telecommunications, VSAT networks; Atlantic Ocean region.""",-24.52,"""35,768""","""35,805""",0.000439,0.01,1436.12Intelsat 906 ,USA,"Intelsat, Ltd.",Commercial,Communications,GEO,,2002-09-06,13,"""72 C-band, 22 Ku-band, broadcasting, business services, direct-to-home TV broadcasting, telecommunications, VSAT networks.""",64.19,"""35,775""","""35,796""",0.000249,0.01,1436.07Intelsat 907 ,USA,"Intelsat, Ltd.",Commercial,Communications,GEO,,2003-02-15,13,"""76 C-band transponders; business, video, internet.""",-27.45,"""35,770""","""35,803""",0.000391,0.02,1436.1Intelsat 10-02 (Thor 4),USA,"Intelsat, Ltd.",Commercial,Communications,GEO,,2004-06-16,13,"""Television, data, and other telecommunication services to Europe, Africa and the Middle East; 36 Ku-band, 70 C-band transponders.""",-0.95,"""35,783""","""35,789""",0.0000712,0.02,1436.08"""Galaxy-28 (G-28, Intelsat IA-8, Telstar 8)""",USA,"Intelsat, Ltd.",Commercial,Communications,GEO,,2005-06-23,13,"""28 C-band, 36 Ku-band, 24 Ka-band; video and data transmissions to all countries in North and South America.""",-88.96,"""35,775""","""35,798""",0.000273,0.01,1436.1Galaxy-17,USA,"Intelsat, Ltd.",Commercial,Communications,GEO,,2007-05-04,15,"""24 C-band, 24 Ku-band transponders; service to North America.""",-91.01,"""35,774""","""35,799""",0.000297,0.02,1436.1Galaxy-18,USA,"Intelsat, Ltd.",Commercial,Communications,GEO,,2008-05-21,15,"""Advanced cable television and data, North America; 24 Ku-band, 24 C-band transponders.""",-123.02,"""35,774""","""35,798""",0.000285,0.02,1436.1"""Intelsat 25 (IS-25, Protostar 1, Chinasat 8)""",USA,"Intelsat, Ltd.",Commercial,Communications,GEO,,2008-07-07,16,"""First satellite of fleet; provides service in Asia. Purchased at auction by Intelsat in October, 2009 for $210 million.""",328.5,"""35,778""","""35,793""",0.000178,0.02,1436.1Galaxy-19,USA,"Intelsat, Ltd.",Commercial,Communications,GEO,,2008-09-24,15,"""50-state coverage, in addition to reaching the Caribbean, Canada and Mexico, to video, government and network customers. """,-97.08,"""35,776""","""35,796""",0.000237,0.05,1436.1Intelsat 14 (IS-14),USA,"Intelsat, Ltd.",Commercial,Communications,GEO,,2009-11-23,16,"""62 transponders, North and South America, Africa and Europe; will also carry an experiment for the US Department of Defense. Internet Routing in Space, or IRIS, is a technology demonstration project which will allow the satellite to perform IP routing rather than requiring a ground station to do so.""",-45,"""35,771""","""35,800""",0.000344,0.02,1436.05Intelsat 16 (IS-16),USA,"Intelsat, Ltd.",Commercial,Communications,GEO,,2010-02-12,15,24 Ku-band transponders; direct-to-home to customers in Mexico and Brazil.,-58.12,"""35,783""","""35,791""",0.0000949,0.07,1436.19Intelsat 17 (IS-17),USA,"Intelsat, Ltd.",Commercial,Communications,GEO,,2010-11-26,16,"""24 C-band , 25 Ku-band transponders serving Europe, the Middle East, Africa, Russia and Asia.""",66,"""35,770""","""35,804""",0.000403,0.03,1436.12Intelsat New Dawn,USA,"Intelsat, Ltd.",Commercial,Communications,GEO,,2011-04-22,15,"""Carries 14 active C-band transponders and 16 Ku-band transponders to serve customers in Africa, the Middle East, Pakistan and Western Europe; the C-band antenna has failed to deploy as of 6/11.""",32.8,"""35,800""","""35,892""",0.00109,0.05,1439.15Intelsat 18 (IS-18),USA,"Intelsat, Ltd.",Commercial,Communications,GEO,,2011-10-05,15,"""24 C-band, 12 Ku-band; Asia Pacific Region""",180,"""35,775""","""35,797""",0.000261,0.01,1436.09Intelsat 22,USA,"Intelsat, Ltd.",Commercial,Communications,GEO,,2012-03-25,18,"""Provide C-band and Ku-band communications services over Africa, Asia, Europe and the Middle East. Intelsat 22 also carries a hosted UHF payload for the Australian Defence Force.""",72,"""35,781""","""35,792""",0.00013,0.03,1436.11"""Intelsat 603 (Intelsat 6 F-3, IS-603)""",USA,"""Intelsat, Ltd./New Skies Satellites N.V. [SES] (shared capacity)""",Commercial,Communications,GEO,,1990-03-14,13,"""Inclined orbit; 64 C-band, 24 Ku-band; Broadcasting, business services, direct-to-home TV broadcasting, telecommunications, VSAT networks; Pacific Ocean region.""",19.84,"""35,778""","""35,795""",0.000202,5.99,1436.12"""Intelsat 15 (IS-15, JCSat 85)""",USA,"""Intelsat, Ltd./Sky Perfect JSAT Corp.""",Commercial,Communications,GEO,,2009-11-30,17,"""Will replace Intelsat 709; 22 Ku-band transponders; Data and video for customers in Russisa, the Middle East and Indian ocean area. Five transponders are directly owned by Sky Perfect JSAT Corp.""",85,"""35,776""","""35,798""",0.000261,0.05,1436.12Intelsat 707 (Intelsat 7 F-7),USA,"""Intelsat, Ltd./Telenor (leased capacity)""",Commercial,Communications,GEO,,1996-03-14,15,"""42 C-band, 36 Ku-band; broadcasting, business services, direct-to-home TV broadcasting, telecommunications, VSATnetworks; Atlantic Ocean region. """,-53,"""35,775""","""35,797""",0.000261,0.01,1436.09Pl_iades HR1 ,France/Italy,"""Ministry of Defense/Centre National d'Etudes Spatiales (CNES) - cooperation with Austria, Belgium, Spain, Sweden""",Government,Earth Observation,LEO,Sun-Synchronous,2011-12-17,5,Optical component of the ORFEO system developed in cooperation with Italy -- Very high resolution panchromatic and multispectral Earth observation satellite.,0,598,611,0.000932,97.99,96.98SORCE (SOlar Radiation and Climate Experiment),USA,"""NASA Earth Science Office/Laboratory for Atmospheric and Space Physics, Univ. of Colorado""",Government/Civil,Astrophysics,LEO,Intermediate,2003-01-25,6,Monitor Sun; improve accuracy of measurement of solar energy.,0,610,649,0.00279,39.9,97.3AcrimSat (Active Cavity Radiometer Irradiance Monitor),USA,"""NASA Goddard Space Flight Center, Jet Propulsion Laboratory""",Government,Solar Physics,LEO,Sun-Synchronous,1999-12-21,5,Monitor total solar irradiance (TSI) with maximum precision; ascertain the extent of solar radiation variability.,0,682,727,0.00318,98.2,98.86TIMED (Thermosphere å« Ionosphere å« Mesosphere å« Energetics and Dynamics),USA,"""NASA/Applied Physics Laboratory, Johns Hopkins""",Government/Civil,Astrophysics,LEO,Intermediate,2001-12-07,2,Study influences of the sun and humans on the least explored and understood region of Earth's atmosphere _ the Mesosphere and Lower Thermosphere/Ionosphere (MLTI).,0,626,627,0.0000715,74,97.24THEMIS A (Time History of Events and Macroscale Interactions during Substorms) ,Multinational,"NASA/University of California, Berkeley",Government/Civil,Space Physics,Elliptical,,2007-02-17,2,Five phase mission to study earth's auroras; mission extended to 2012. Themis B and C retasked as Artemis mission to L1 and L2.,0,461,"""87,304""",0.864,15.7,1868.98THEMIS D (Time History of Events and Macroscale Interactions during Substorms) ,Multinational,"NASA/University of California, Berkeley",Government/Civil,Space Physics,Elliptical,,2007-02-17,2,Five phase mission to study earth's auroras; mission extended to 2012. Themis B and C retasked as Artemis mission to L1 and L2.,0,467,"""87,260""",0.864,15.7,1867.91THEMIS E (Time History of Events and Macroscale Interactions during Substorms) ,Multinational,"NASA/University of California, Berkeley",Government/Civil,Space Physics,Elliptical,,2007-02-17,2,Five phase mission to study earth's auroras; mission extended to 2012. Themis B and C retasked as Artemis mission to L1 and L2.,0,474,"""87,526""",0.864,15.7,1875.53SAC-C (Satellite for Scientific Applications),Multinational,"""National Commission of Space Activities (CONAE) (with NASA, Denmark, Italy, Spain, France, Brazil)""",Civil,Earth Observation Research,LEO,Sun-Synchronous,2000-11-21,4,"""Remotely-sense vegetation, wetlands, and ecosystem in four wavelength bands""",0,687,706,0.00134,98.2,98.71"""COSMIC-A (Formosat-3A, Constellation Observing System for Meteorology, Ionosphere and Climate)""",Taiwan/USA,National Space Program Office (NSPO)/University Corporation for Atmospheric Research (UCAR) ,Government/Civil,Remote Sensing,LEO,Sun-Synchronous,2006-04-15,2,Ì±. . . Provide atmospheric data daily in real time over thousands of points on Earth for both research and operational weather forecasting by measuring the bending of radio signals from the U.S. Global Positioning System (GPS) as the signals pass through Earth's atmosphere.Ì¨,0,800,800,0,72,100.87"""COSMIC-B (Formosat-3B, Constellation Observing System for Meteorology, Ionosphere and Climate)""",Taiwan/USA,National Space Program Office (NSPO)/University Corporation for Atmospheric Research (UCAR) ,Government/Civil,Remote Sensing,LEO,Sun-Synchronous,2006-04-15,2,Ì±. . . Provide atmospheric data daily in real time over thousands of points on Earth for both research and operational weather forecasting by measuring the bending of radio signals from the U.S. Global Positioning System (GPS) as the signals pass through Earth's atmosphere.Ì¨,0,800,800,0,72,100.87